,username,date,time,text,tweetID,placeID,daerah,lokasi,longitude,latitude,result
1505,@yvongloriabella, 2018-05-02, 03:36, Perutku norak  tiap dikasi makan black pizza pasti mules. ,991416198167330816, 6e0f0a00ef60a2bf, Kalimantan Barat, Kalimantan Barat Indonesia,111.10989522389193,-0.4793298500000001,perut norak kasih makan black hamburger mulas
1506,@deasychicco, 2018-05-02, 03:09, duh saking mad bgt geram sampe2 mules perut lg mens aja sampe ga kerasa loh..pdhl bnr2 lagi mulees,991409332259454976, a0ab46b927a3431d, Tangerang, Tangerang Indonesia,106.63483924338509,-6.186222,duh saking mad banget geram bain mulas perut lg mens aja ampe gue asa lohpdhl bnr mulees
1507,@virginiaels8, 2018-05-02, 07:27, hal yg menyebalkan adalah ketika udh siap mau berangkat kekantor tetiba perut mules.,991474305702612992, 68b536c5b253c1b0, Kalideres, Kalideres Indonesia,106.71026670119466,-6.1395765,yg sebal uda berangkat kantor kejap perut mulas
1508,@dudit1105_, 2018-05-02, 08:55, anxiety level udah gak bisa nahan sakit perut dan mules berkepanjangan. bentar lagi w mual2 nih,991496351585259520, cf712fd91280ebff, Denpasar Barat, Denpasar Barat Indonesia,115.19736477704636,-8.650534,cemas level uda tahan sakit perut mulas bentar w mual nih
1509,@holymolykookie, 2018-05-02, 08:44, Udah dong sakit perut ini gua :'''',991493648146579456, 7c7e93f29191841c, Ciledug, Ciledug Indonesia,106.71323455829788,-6.220018,sakit perut gua
1510,@OteTatsuya, 2018-05-02, 22:24, betul dos  mari biarkan dia mencret paripurna. kerasa dong gregetnya uda bikin twit mencak2 tp ga ada respon.,991699962755862528, 526b5b0a9ee00dc6, Sukawati, Sukawati Indonesia,115.26958379254893,-8.583452000000001,dos mari biar mencret paripurna asa gereget uda bikin email mencak tp gue respons
1511,@IndriEkaSaras, 2018-05-02, 17:39, Mencret nanti mbak ,991628115792166912, f339acbd799e8a84, Boyolali, Boyolali Indonesia,110.59332353964058,-7.5179895000000005,mencret mbak
1512,@albert_na, 2018-05-02, 22:16, Terus aku juga nggak pedean orangnya pas masuk SD.   Waktu kelas satu aku pernah pup di celana karna diare. Terus malah diejek sama teman-teman dan kesalnya guru aku pas kelas 1 juga nggak bersimpati. Karna terlanjur malas kali ya ngurus si anak nakal.,991697912982749184, 8497d03e1326d719, Tembalang 1, Tembalang 1 Indonesia,110.45992018189705,-7.0477785000000015,gede orang pas masuk mi kelas bab sidi celana diare ejek teman jengkel guru pas kelas  simpatik telanjur malas kali ya urus sang anak nakal
1513,@deasychicco, 2018-05-02, 14:07, makan ini dulu dah ntr baru mkn yg agak berat soalnya lg mules bgt ga terlalu laper ,991574957611085824, a0ab46b927a3431d, Tangerang, Tangerang Indonesia,106.63483924338509,-6.186222,makan dah oke mkn yg berat lg mulas banget gue lapar
1514,@OteTatsuya, 2018-05-02, 22:18, mencret paripurna bin konyol. ,991698384292474880, 526b5b0a9ee00dc6, Sukawati, Sukawati Indonesia,115.26958379254893,-8.583452000000001,mencret paripurna bin konyol
1515,@deasychicco, 2018-05-02, 17:24, waduuh sbnrnya lg nahan mules ini gw tetep jalan ke mall sms hahah,991624409369657344, 1d982263cb72d996, Curug, Curug Indonesia,106.60084247333721,-6.2437809999999985,lg tahan mulas gue jalan tuju mal telpon hahah
1516,@KayuagungRadio, 2018-05-02, 09:47, #NAKTAUNIAN Anak diare perlu antibiotik atau tidak? Diare merupakan salah satu penyakit yang kerap menyerang anak-anak. Untuk penanganan diare ini  Pertama  pastikan dulu bahwa kecukupan cairan si Kecil sudah kembali terpenuhi.,991509351213907968, 70d779a2aa1516db, Kota Surabaya, Kota Surabaya Jawa Timur,112.73087094790115,-7.277097500000001,bunian anak diare antibiotik diare salah sakti kerap anak tangan diare cair sang penuh
1517,@chizznanda, 2018-05-02, 08:12, Ga ngerti kenapa kalo minum yg rasa coklat endingnya perut mesti mules.  Koyone aku ra patut ngombe coklat ,991485463323000833, 31569f33fbe4e733, Lowokwaru, Lowokwaru Indonesia,112.60684962877414,-7.943314999999999,erti kalo minum yg coklat plot perut mesti mulas koyone seg patut mampir coklat
1518,@yulinda_psi, 2018-05-02, 22:21, Lalu suamiku. Sakit perut  disuruh rontgen (aneh bukan? Mestinya USG ) Didiagnosa appendix (usus buntu). Langsung disuruh operasi. Karena terkait operasi  pergilah mencari second opinion ke dokter lainnya.,991699270733516801, cf49b485a7021017, Medan Selayang, Medan Selayang Indonesia,98.63831562987326,3.56782945,suami sakit perut rontgen aneh ultrasonografi diagnosis apendiks usus buntu langsung operasi kait operasi pergi cari ken opini tuju dokter lai
1519,@ikhhsn, 2018-05-03, 17:46, Perut mules  yang mau keluar udah diujung  cari toilet gak ketemu  tapi tetap enak dilihat pada saat yang sama. ,991992394324230144, 1e29a0a2def987cb, Medan Deli, Medan Deli Indonesia,98.68685145032455,3.67898865,perut mulas uda ujung cari toilet ketemu enak lihat
1520,@chicohakim, 2018-05-03, 15:05, Sakit perut? Kenapa sakit perut? Pendukung lo pada gilak nih @sandiuno coba dirapatkan barisannya  takutnya nular.,991951852706000896, 00ce43ecd091a5e8, Kebayoran Baru, Kebayoran Baru Indonesia,106.80793714435305,-6.2445845,sakit perut sakit perut dukung elu gila nih sandi coba rapat baris takut tular
1521,@aurasmaradana, 2018-05-03, 15:41, Iya. Makanya mules diajak joget sih,991961029713145856, 0e960886390aa80d, Kramat Jati, Kramat Jati Indonesia,106.87059351073131,-6.275767999999999,mulas ajak joget sih
1522,@desymiladiana, 2018-05-03, 11:02, Lagi nungguin antrian dokter  mendadak perut mules.  Aku bisa apa? ,991890837637287936, 31569f33fbe4e733, Lowokwaru, Lowokwaru Indonesia,112.60684962877414,-7.943314999999999,tunggu antre dokter dadak perut mulas
1523,@mypurplebee_, 2018-05-03, 13:37, mulai sakit perut ,991929806181691392, 019ffe0a3471b036, Tanah Abang, Tanah Abang Indonesia,106.81773603395331,-6.2016105,sakit perut
1524,@ekoyepe, 2018-05-03, 23:24, Nganti mules,992077363843235840, 62250815f421783d, Purworejo, Purworejo Indonesia,110.01602406560677,-7.726974,anting mulas
1525,@radendea, 2018-05-03, 21:25, Udah gabisa bedain lg mana mules pengen  dan mules mau brojol HHHHHH  au ah~,992047419897466881, 62036130f065f31e, Arcamanik, Arcamanik Indonesia,107.6771103464542,-6.921403,beda lg mulas ken mulas rojol hhhhhh au tawadu
1526,@cangkir_item, 2018-05-03, 03:42, Jam segini nginep di lab dan mules  sangat pr,991779866843332608, 2c0294c5eab821c9, Coblong, Coblong Indonesia,107.6142103008952,-6.88176745,jam gin inap sidi lab mulas pr
1527,@a__prawira, 2018-05-03, 19:22, playlist #1 gue tuh @LittleMix yg judulnya #secretlovesong     ga kebayangkannnnn...???!!! yaudah sih jangan dibayangin  ntar pada mules. ,992016495164059649, 00ce43ecd091a5e8, Kebayoran Baru, Kebayoran Baru Indonesia,106.80793714435305,-6.2445845,playlist  gue nih littlemix yg judul pesong gue bayang aja sih bayang entar mulas
1528,@vta_sari, 2018-05-03, 21:44, dari laper trus deg2an jd sakit perut..syukurlah udah sampe rmh..alhamdulillah,992052253220519942, 66555622726ab358, Setia Budi, Setia Budi Indonesia,106.8350755724146,-6.2213485,lapar kalo degan jd sakit fisi uda ampe alhamdulillah
1529,@opinidion, 2018-05-03, 22:44, Kamu kayak mules. Datang dan pergi sesuka hati.,992067467907186688, 48fa312df6d273f1, Sawahan, Sawahan Indonesia,112.72146290804228,-7.275803,kayak mulas pergi suka hati
1530,@SonyFebryan, 2018-05-03, 02:19, Turu kw wis bngi mboan mencret zum hihihi,991759002257141760, 849e167064f094d2, Tanjung Priok, Tanjung Priok Indonesia,106.87786932786379,-6.1299044,lei sil dewe bngi idulfitri mencret zum hihihi
1531,@TiiaraAyu, 2018-05-04, 14:59, kena ujan. sakit perut. telat makan. sakit perut. begadang. sakit perut. makan pedes. sakit perut. tapi kok ga slim slim ya kayak nyanyaaaaio :(,992312736242515973, 08a21067b8eaf319, Sukarami, Sukarami Indonesia,104.71355124615879,-2.916703,kena hujan sakit perut telat makan sakit perut begadang sakit perut makan pedas sakit perut gue peplum peplum ya kayak nyanya
1532,@genthongifa, 2018-05-04, 16:42," ku mau gerundel (dan curcol) mengenai kelakhuan para ""customer"" yg aneh2 ah... ndapapa daripada mules sendirian",992338543606300674, c05dfe6f552ce6b1, Gubeng, Gubeng Indonesia,112.75407403620471,-7.2840905,mu gerundel bacot dil customer yg aneh tawadu mendap mulas
1533,@ArdiannArd, 2018-05-04, 17:19, Makanan baru aja datang  perut malah mules. Mau ga mau harus dihabiskan ketika masih panas.,992347958434709504, b6bbc85d8e3411a0, Banjarsari, Banjarsari Indonesia,110.81564512467041,-7.547169699999999,makan aja perut mulas gue habis panas
1534,@Dhe_Gea, 2018-05-04, 16:12, Buka twitter  DM Instagram masuk. Pas buka instagram  ada mention masuk. Bulak-balik aja lu dhe dari twitter ke IG biar keliatan kek orang diare gitu -____-,992331186209898501, d16052cf1200267a, Menteng, Menteng Indonesia,106.84217356555288,-6.1902370000000015,buka twitter ida instagram masuk pas buka instagram mention masuk dempet aja elu pas twitter tuju ig biar liat kek orang diare aja
1535,@adlimrn, 2018-05-04, 10:51, Kerempongan pagi hari bolak balik bolak balik ditambah sakit perut maknyos! Awas aja kalau ga jadi ,992250256392835075, d16052cf1200267a, Menteng, Menteng Indonesia,106.84217356555288,-6.1902370000000015,rempong pagi bolak bolak sakit perut maknyos awas aja gue
1536,@PrasetyoDimas2, 2018-05-04, 15:31, Maitimo diare atau sakit mata lagi ? ,992320891450085376, dee36bf24ad34bfb, Pangkalan, Pangkalan Indonesia,107.24346833215472,-6.504075,maitimo diare sakit mata
1537,@irsandyrmdhn, 2018-05-04, 00:45, Bangsuy  tadi siang dibeliin Siomay makannya pake saus indo*food perut jadi mules Terus tadi abis maghrib dibeliin nasgor pedes + banyak :( Dan barusan abis beraq :( Sekarang jadi lpr :(,992097956781113344, ae08c074b545d4a3, Serang, Serang Indonesia,107.14871453924637,-6.370803,bangsa siang beli cilok makan pakai saus mem perut mulas abis magrib beli capcai pedas barusan abis sewah tais
1538,@nitarose38, 2018-05-04, 18:55, Bisa kali hahahhaha  Tapi siap2 aja abis nyalon kita diare ,992372151863857152, d658c55e8461b256, Tambora, Tambora Indonesia,106.80627110932173,-6.1488885,kali hahahhaha aja abis salon diare
1539,@risnacucu21, 2018-05-04, 09:10, Apalah aku mah pagi2 minum susu aja mencret,992224911950204929, e1efc63ca2c038b8, Citeureup, Citeureup Indonesia,106.88425355223607,-6.5444475,mah pagi minum susu aja mencret
1540,@mferian_, 2018-05-04, 10:03, Ngising beling  mencret ceret,992238355801817088, 35a7a10363641f3f, Turi, Turi Indonesia,110.37897516907358,-7.6267905,sing beling mencret ceret
1541,@alfytrizq, 2018-05-04, 00:04, Sakit perut beb gak bisa kentut. Huhu,992087417824788480, 8eb541a13a3d56e2, Wonotunggal, Wonotunggal Indonesia,109.76271974611431,-7.0324550000000015,sakit perut beb kentut huhu
1542,@aukuman, 2018-05-04, 23:08, Seharian mules dan diare  udah 4x. Terakhir pup  isinya cabe semua. Good job  dear stomach! ,992435901048410112, 2cd5efeb7102867f, Grogol Petamburan, Grogol Petamburan Indonesia,106.79070212617808,-6.1618445,mulas diare uda x bab isi cabe good tugas hai stomata
1543,@zahrakhrn, 2018-05-05, 04:15, Jadi tuh  pagi buta jam segini gue kebwngun gegara mules kepengen sakit perut. Alhasil yaudah dong ke kamar mandi untuk menuntaskan ini semua drpd bobo ku terganggu ya kan,992513033413931008, 31e4594e7a7e7e89, Pasar Rebo, Pasar Rebo Indonesia,106.8616602208678,-6.3283165,nih pagi buta jam gin gue kebwngun gegar mulas ken sakit perut walhasil aja tuju kamar mandi tuntas doa bobok mu ganggu ya
1544,@zahrakhrn, 2018-05-05, 04:19, Udah semua  mau lanjutin tidur dong  secara tidur baru bentar  keganggu gegara mules. Mulai lah disini semua terjadi....,992513972317270016, 31e4594e7a7e7e89, Pasar Rebo, Pasar Rebo Indonesia,106.8616602208678,-6.3283165,tidur carah tidur bentar ganggu gegar mulas
1545,@meiokris, 2018-05-05, 06:38, Waduh sepagian mules,992549134304358400, 67ee4e65b49cb758, Kalimantan Selatan, Kalimantan Selatan Indonesia,115.51599417801836,-2.74566825,pagi mulas
1546,@kuswan_uchan, 2018-05-05, 06:17, Tonton semrawut bikin sakit perut..  Full video: https://youtu.be/k9m0Zx_yH2M   #iseng #music #guitar #electric #funk #rock #jamming #practice #record,992543794275930113, 6066956b38a2b2d9, Pancoran Mas, Pancoran Mas Indonesia,106.81524535347694,-6.3944565,tonton semrawut bikin sakit perut full video iseng music gitar piezoelektrik funk metal jamming practice record
1547,@Fatkhul_Huda75, 2018-05-05, 10:39, Silahkan elu mencret. karna jokowi selalu meroket.,992609614452613120, 4e804e21f22144e1, Kebon Jeruk, Kebon Jeruk Indonesia,106.77566264806022,-6.1856019999999985,silah elu mencret jokowi roket
1548,@islamiantoo, 2018-05-05, 09:51, Kenapa tiap weekend selalu mules seharian ,992597665123725312, 019ffe0a3471b036, Tanah Abang, Tanah Abang Indonesia,106.81773603395331,-6.2016105,weekend mulas
1549,@mnaufalshidqi, 2018-05-05, 21:20, Selalu setelah makan mules.... Bakal jadi langganan pom bensin sih ini,992771096075091968, b05ab60b6c5fcaab, Regol, Regol Indonesia,107.61360181927782,-6.93910275,makan mulas langgan bensin bensin sih
1550,@putriprstya, 2018-05-05, 21:17, Mules terus :( karna boncabe sih ini bukan kontraksi.,992770370372419584, 70e9459a0d086839, Dau, Dau Indonesia,112.55909266091743,-7.9479440000000015,mules cabe sih kontraksi
1551,@duuwiieedwi, 2018-05-05, 19:20, tgl 1 sakit perut bolak balik kamar mandi semcam diare...berlanjut ke tgl 2 tak berani makan sjak pagi krn takut skit perut smpe tgl 3 Jg tak makan tgl 4 nanti malam bru makan hrini tgl5 mlam hlgan jd skit prutnya krn mens....,992740852731559936, f50436e042d3f6a6, Mandonga, Mandonga Indonesia,122.48510355040314,-3.9841273,tanggal  sakit perut bolak kamar mandi tuju tanggal  berani makan mei pagi takut sikit perut tanggal  jg makan tanggal  malam makan syur pipet mei hlgan jd sikit duk mens
1552,@M_Aantri, 2018-05-05, 17:17, Sindromku elek banget. 4 bulan gak pernah mikir serius sekali mikir serius langsung mules ,992709912936431616, 985d2f4ed1a2b7ef, Kalasan, Kalasan Indonesia,110.46639952064777,-7.744382499999999,sindrom kelek banget  pikir serius pikir serius langsung mulas
1553,@josepep_, 2018-05-05, 22:53, Yang laen pada mabok le minum aku malah sakit perut le minum,992794497158332417, 3864545e921bbfdd, Pakem, Pakem Indonesia,110.41545765711392,-7.621937,ato mabuk sar minum sakit perut sar minum
1554,@nanda_afrian, 2018-05-05, 22:49, cikarang cibitung cikampek cilincing cilacap cilandak (?)  Aq mo ke kamar mandi dulu  mules :(,992793296891035648, d9f4061c2a17410e, Baitussalam, Baitussalam Indonesia,95.43005082713114,5.5818595,bekas bekas kampemen ciling kalong tandak aq tuju kamar mandi mulas
1555,@nanda_afrian, 2018-05-05, 22:45, Boro-boro miras  minum yakult aja mules,992792458269360129, d9f4061c2a17410e, Baitussalam, Baitussalam Indonesia,95.43005082713114,5.5818595,putih mol minum yoghurt aja mulas
1556,@dimasadityadp, 2018-05-05, 20:12, Ini kenapa perut tidak bisa dikompromi dikit  kena sambel dikit mesti langsung mules :(,992753913991385088, 9994ec8e687edf08, Tambaksari, Tambaksari Indonesia,112.76283312388071,-7.2532225000000015,perut kompromi dikit kena sambal dikit mesti langsung mulas
1557,@elisaganis, 2018-05-05, 23:25, Marakke mules le di pangan isuk isuk ,992802468894420993, 408ad88ee0345f7d, Depok, Depok Indonesia,110.40824265575323,-7.76769565,semarak mulas sar sidi pangan om om
1558,@al_sadewaa, 2018-05-06, 05:38, Ett dah ni perut masih aja mules,992896277988884480, ae188c2b719d333e, Gondokusuman, Gondokusuman Indonesia,110.38095848372015,-7.786040700000001,rel dah sok perut aja mulas
1559,@dinaaaya, 2018-05-06, 14:45, Gegara makan cilor yang dikasih temen semalem  sekarang jadi mencret alias apaaan nih pasti semalem gue diracunin!,993034030542045184, 9633ced0e1b00f7c, Bojongsari, Bojongsari Indonesia,109.34007440765689,-7.344067499999999,gegar makan cilok kasi teman maleman mencret alias nih maleman gue racun
1560,@gimbaliaMarley, 2018-05-06, 11:43, Nahan mules sama nahan rindu sama-sama nyiksa !,992988137092661249, d88db2919bf03a65, Denpasar Timur, Denpasar Timur Indonesia,115.23911263358866,-8.633407400000001,cape mulas tahan rindu siksa
1561,@jguntari, 2018-05-06, 10:03, Me: Mak  adek sakit perut.. Umak: salahmu..  BAIQLAAAAHHH ,992962999232090112, 6e0f0a00ef60a2bf, Kalimantan Barat, Kalimantan Barat Indonesia,111.10989522389193,-0.4793298500000001,me lampir kakak sakit perut etek salah toilet
1562,@yudhie86, 2018-05-06, 12:39, Gimana si mukidi ANU beserta moncong putihnya gak panik kalo begini...   Pendukunnya kejang kejang perut mules mules  #2019GantiPresiden  #2019PresidenBaru  #2018GantiGubernurJateng ,993002368739360768, 62f9f7941af63107, Tebet, Tebet Indonesia,106.85685564264601,-6.2258419000000025,sang tawon anu moncong putih panik kalo dukun kejang kejang perut mulas mulas presiden email kupat
1563,@keynantea, 2018-05-06, 10:33, Tiga hari sakit perut efek makan mangga muda tiga hari berturut turut ,992970479945175040, 6e0f0a00ef60a2bf, Kalimantan Barat, Kalimantan Barat Indonesia,111.10989522389193,-0.4793298500000001,sakit perut efek makan mangga muda
1564,@SantiNov21, 2018-05-06, 09:56," Pantes perut ku mules"" sesak bokerr.. d sebut"".. ",992961310768807938, 0e960886390aa80d, Kramat Jati, Kramat Jati Indonesia,106.87059351073131,-6.275767999999999,mang perut mu mulas sesak bokerr d
1565,@sederhananih, 2018-05-06, 21:26, makan  ngantuk  tidur  bangun  laper lg  mules  berak  laper lg  ngantuk lg.... itu lebih menyenangkan,993134889489711115, 56a3ddb48e856c55, Campaka, Campaka Indonesia,107.49935570136623,-6.4936460500000015,makan antuk tidur bangun lapar lg mulas berak lapar lg antuk lg nangka
1566,@brendaadel, 2018-05-06, 14:03, Yang paling disebelin dari pergi subuh-subuh adalah: mules karena ga sempet setoran,993023546128412673, 2d46dbd9431c332e, Legok, Legok Indonesia,106.60432021752659,-6.292148,bin pergi subuh mulas gue setor
1567,@sederhananih, 2018-05-06, 21:29, ini KKN macam apa sih? kerjaannya bangun tidur-sarapan-tiduran lg-makan siang-tidur siang-bangun-laper lg-mules-diberakin-laper lg huhuhuhu sehat sekali hidupku,993135583739265025, 56a3ddb48e856c55, Campaka, Campaka Indonesia,107.49935570136623,-6.4936460500000015,korupsi sih kerja bangun tidur dogma tidur bangun lgmulesdiberakinlaper lg huhuhuhu sehat hidup
1568,@kepanguiik, 2018-05-06, 22:51, WEHHH GUE MENDADAK MULES BENERAN LIAT TL ISINYA TENTANG INTRO #SINGULARITY SEMUA ANJIRRR~~ INI MASIH SI TETET DOANG GUE UDH BEGINI  GIMANA NANTI PAS MV KELUAR??!!,993156378158972929, f48804e2e35d1099, Pasar Minggu, Pasar Minggu Indonesia,106.83613013640064,-6.293493,wehhh dorong alikuot heran pustaka lat definisi intuisi singularity koreksi mawon den deh tafsir tembus kanti dap jet
1569,@FenJho, 2018-05-06, 09:31, Di lain hari.  SC. Gw kira Sectio Caesarea. Taunya Screen Capture.  AI. Gw kira Artificial Intelligence. Taunya maksud dia Auto Immune.  TB. Gw kira tuberculosis. Taunya Toko Bangunan.,992954960345092096, 6c8aa00f3ecfda7f, Banten, Banten Indonesia,106.11479673475084,-6.437779,sidi sc gue sectio kaisar bonyok screen capture laici gue artifisial inteligen bonyok maksud auto auto gue tuberculosis bonyok toko bangun
1570,@DharmawanReza, 2018-05-06, 23:37, MUDIK = Mules Ditanya Kawin  #ad,993167969688604672, eaccf46fdb83a44b, Bubutan, Bubutan Indonesia,112.7326795317936,-7.249600999999998,lebaran mules kawin libitum
1571,@andinaseptrian1, 2018-05-06, 21:58, Prekju lvl 3 aja udah mules  oh perut cupu sekali engkau :'),993142918813663233, 33763627a2a6eeb1, Magelang Selatan, Magelang Selatan Indonesia,110.21902494108556,-7.4907024999999985,prekju lvl  aja uda mulas oh perut cupu engkau
1572,@sakurakuchan_, 2018-05-06, 22:32, Ketawa malam ini bikin sakit perut  padahal ga ketemu  tapi lucu banget. Sugoi! ,993151590793035778, 2b8a188e15cd8d6a, Klari, Klari Indonesia,107.36514587395176,-6.352461,tawan malam bikin sakit perut gue ketemu lucu banget boku
1573,@fabiankwdn, 2018-05-07, 22:32, Kayak apa ya rasanya  belum mulai tahun senior tapi kok ya pingin tegar tapi mules sendiri mikirnya ,993513805714878464, 31569f33fbe4e733, Lowokwaru, Lowokwaru Indonesia,112.60684962877414,-7.943314999999999,kayak ya senior ya ken tegar mulas pikir
1574,@ery_MoveOn, 2018-05-07, 09:18, hadeh pagi2 prut dah mules :-'),993314052213432320, a0ab46b927a3431d, Tangerang, Tangerang Indonesia,106.63483924338509,-6.186222,adeh pagi bun dah mulas
1575,@Kadeduabelas433, 2018-05-07, 07:48, Pengeneee...ckup spisan bae..JOKOWI gw mules..gw lara rakyat karepe dwek kebablasan...#2019 GANTI PRESIDEN,993291503412830208, e18cdb4e28bbaabb, Mundu, Mundu Indonesia,108.58346920362166,-6.7723315500000005,kembang cas mujahidin gue cape lara rakyat dewe his bablas ganti presiden
1576,@NetiTRW, 2018-05-07, 19:48, Saya  kalau sedang sakit perut  ,993472762218885121, baba7178a0f8c5f4, Senen, Senen Indonesia,106.85550123407222,-6.1823335,sakit perut
1577,@rzqmysf, 2018-05-07, 09:46, Ga bisa diajak kerja sama nih. Masa sarapan roti doang perutnya mules. Gimana nanti kalo tinggal di eropa,993321158056427520, 4cb9dedf236475ad, Jagakarsa, Jagakarsa Indonesia,106.82795154196195,-6.332802,ajak kerja nih sarap roti doang perut mulas kalo tinggal sidi era
1578,@iintanpermata, 2018-05-07, 21:22, Akhirnya nyobain oseng mrecon bu narti semoga besok ga mules,993496353094352897, 0101781eef585ee9, Yogyakarta, Yogyakarta Indonesia,110.41343442386848,-7.874352,soba tumis mrecon bude moga besok gue mulas
1579,@duuwiieedwi, 2018-05-07, 19:08, sejak tragedi sakit perut tgl 1 smpe skrg msh trauma makan sayur bening  jd makannya mulai pilih2  sprti malam ini makan malamnya pisang ijo #gwsforme ,993462468386078721, 653f905c6ce7a55b, Kolaka, Kolaka Indonesia,121.60222523685543,-3.9784086,tragedi sakit perut tanggal  bom trauma makan sayur bening jd makan pilih malam makan malam pisang hijau gwsforme
1580,@htiranda, 2018-05-07, 18:41, Hari terakhir #fieldwork dikasih oleh-oleh sengatan tawon di bujur. Mendadak demam + diare udah 2 hari ,993455753779281920, 835fc4688b7053ac, Papua Barat, Papua Barat Indonesia,130.84085991257894,-0.231445,fieldwork kasi sengat tawon sidi bujur dadak demam diare uda 
1581,@dinilarasati92, 2018-05-07, 17:51, Lupa rasanya ketawa sampe sakit perut ya … https://www.instagram.com/p/BieTddsAeBUS0c7DPghjL3nZH2Wv_FW-06YPrw0/?utm_source=twitter …,993443261271498752, 34e4fb419d925d98, Gantung, Gantung Indonesia,108.0676950829919,-2.98094255,lupa ketawa ampe sakit perut ya aja aja
1582,@mas_syarif1, 2018-05-07, 05:48, Perut kosong. Pagi pagi minum chocolate +susu flag  semoga nga sakit perut. Kok rasanya mirip susu Hilo eh bonetto ding.. ,993261183531565056, 93aa30b3e9be6b59, Cengkareng, Cengkareng Indonesia,106.74904405919071,-6.150752,perut kosong sore pagi minum chocolate susu flag moga sakit perut susu limfa eh bonetto cing
1583,@naniraa_, 2018-05-07, 07:00, masalah dipagi hari bermula ketika pgn sarapan tp takut mules,993279354904788992, 408ad88ee0345f7d, Depok, Depok Indonesia,110.40824265575323,-7.76769565,pagi om sarap tp takut mulas
1584,@nasrulumam16, 2018-05-07, 12:50, Perut mules dari tadi pagi~~hadeh  pasti gara2 tadi malem~~~~,993367401591787521, 3d48dc8085b11821, Genuk, Genuk Indonesia,110.47215475457041,-6.96426165,perut mulas sampa maleman
1585,@utiiiiiw, 2018-05-07, 13:43, makan roti ada pisangnya  udahannya sakit perut,993380718976819200, 25f5e9dbc1b635ac, Gambir, Gambir Indonesia,106.82605578723835,-6.168961,makan roti pisang sakit perut
1586,@LiaaMajesty, 2018-05-07, 06:41, Faktanya  di dalam cabe emang ada kandungan senyawa (lupa namanya) yang bisa bikin mencret. Tapi mencret itu dikarenakan pencernaan anak tersebut sensitif/alergi dg senyawa tsb. Dan ada juga yang ngga alergi. Tergantung dr respon tubuh masing-masing.,993274531698503680, 6756ddd483014715, Bantur, Bantur Indonesia,112.54925793477085,-8.3003235,nyata sidi cabe emang kandung senyawa lupa nama bikin mencret mencret cerna anak alergi senyawa alergi gantung sport respons tubuh
1587,@Rahma_agstn, 2018-05-07, 16:44, Usah ton. Marai ngiluu Mgko mencret hahahaa,993426419538477056, 0f5663ec8d8681e5, Purwokerto Utara, Purwokerto Utara Indonesia,109.23740870943148,-7.39976395,ton mara ngilu kibas mencret hahahaa
1588,@Adsptnas, 2018-05-07, 03:27, Buruan kelar  mules liatnya anjeeer,993225757265555456, 3d48dc8085b11821, Genuk, Genuk Indonesia,110.47215475457041,-6.96426165,buru kelar mulas liat anjeeer
1589,@tatiira, 2018-05-07, 01:56, Astagfirulloh Al adzim Kau iblis gue kebangun karna sakit perut gue   Dan panas yg menggigit Diubun2 kepala    Ya allah tersiksanya hidup gue  terhina banget hidup gue ma lu astagfirulloh Al adzim Kau penyanyi iblis,993202801986621440, ad4a2a47ef7491d4, Margaasih, Margaasih Indonesia,107.55070241306915,-6.947334,astagfirullah al adzim kau iblis gue bangun sakit perut gue panas yg gigit lecun kepala ya allah siksa hidup gue hina banget hidup gue ma elu astagfirullah al adzim kau nyanyi iblis
1590,@ptchdw, 2018-05-07, 00:15, Saya sedang merasakan mules. Diujung malam seperti lagu payung teduh.,993177425889525760, d04153eab7badc97, Lembang, Lembang Indonesia,107.66986096467596,-6.81347665,mulas hujung malam lagu payung teduh
1591,@faridzeks, 2018-05-07, 16:04, Acara WIT  bikin sakit perut bang. Ketawa ga berhenti. Kerennnn,993416217577730051, 6791341b86965709, Majalaya, Majalaya Indonesia,107.74799309634943,-7.0345405,acara wit bikin sakit perut bang tawan gue henti keren
1592,@MarineCulture, 2018-05-08, 17:01, 08 MAY 2018. Tim GRTC telah melaksanakan sesuai prosedure.  Ikan Segar => Proses ulang √  Bahaya Biologis/Mikrobiologis  disebabkan oleh bakteri pathogen   virus/parasit yg dpt menyebabkan keracunan  penyakit infeksi/infestasi  misalnya: E.Coli pathogenik dll.   Sumber: BKIPM. ,993793099032752128, 3bd26dc3bcd6d4a6, Gerokgak, Gerokgak Indonesia,114.79315069345293,-8.205136999999999, jun  tim grtc laksana sesuai prosedur ikan segar proses ulang bahaya mikrobiologis akibat bakteri patogenesis virus yg akibat racun sakti infeksi coli patogenik sumber bawat
