,username,date,time,text,tweetID,placeID,daerah,lokasi,longitude,latitude,result
724,@adeliadyah4, 2018-03-03, 14:02, Aku suka pedes jga tp makan boncabe yg level 15 aja cuma berani sedikit  itu aja paginya langsung diare sumpah gak boong. Gmana ini level 30 kasian lambungnya atuh T_T,969830309976989697, 9131ec0f892bace2, Tegalrejo, Tegalrejo Indonesia,110.35731604347694,-7.7794507999999984,suka pedas tp makan cabe yg level  aja berani aja langsung diare sumpah bohong level  kasi lambung mah tt
725,@diyon_sc, 2018-03-03, 14:58, Sakit perut njir ,969844572682530816, 31c7d4a3931a9052, Jakarta Timur, Jakarta Timur DKI Jakarta,106.90064915911852,-6.262378,sakit perut banjir
726,@MelatiNoerFajri, 2018-03-03, 17:23, Mas @manglambas Loving Vincent jangan dilewatkan ya..  Mohon disegerakan karena bikin mules.,969881018034372609, 408ad88ee0345f7d, Depok, Depok Indonesia,110.40824265575323,-7.76769565,mas indonesia vincent ya mohon bikin mulas
727,@asmansaja, 2018-03-03, 22:56, minum kopi ngantuk  minum es jeruk malah sakit perut  man mannn..,969964691836477440, 67ee4e65b49cb758, Kalimantan Selatan, Kalimantan Selatan Indonesia,115.51599417801836,-2.74566825,minum kopi antuk minum es jeruk sakit perut man mannn
728,@mgaselba, 2018-03-03, 19:30, grgr diare bikin lemeskzl.,969913022079627265, 32b242657c638eb5, Gamping, Gamping Indonesia,110.33204772307415,-7.784254000000002,mutisme diare bikin ekonomi
729,@jguntari, 2018-03-03, 21:35, SAKIT PERUT DONG ,969944321234427904, 6e0f0a00ef60a2bf, Kalimantan Barat, Kalimantan Barat Indonesia,111.10989522389193,-0.4793298500000001,sakit buncit bom
730,@nanda_afrian, 2018-03-04, 02:25, Dilema adalah ketika ngantuk berat  tapi perut mules. Antara mau langsung tidur aja atau ke kamar mandi dulu.,970017262856945665, d9f4061c2a17410e, Baitussalam, Baitussalam Indonesia,95.43005082713114,5.5818595,lat antuk berat perut mulas langsung tidur aja tuju kamar mandi
731,@anomputera, 2018-03-04, 01:25, mau tidur malah sakit perut ,970002258430607361, ece4608dcf153c57, Kediri, Kediri Indonesia,115.12568064582187,-8.575852000000001,tidur sakit perut
732,@edwindjaja_, 2018-03-04, 19:20, Inget banget dulu awal ke Jogja pertama kali makan tendaan di jogja besoknya langsung mencret haha,970272668703367173, 2d46dbd9431c332e, Legok, Legok Indonesia,106.60432021752659,-6.292148,banget tuju jogja kali makan renda sidi jogja besok langsung mencret haha
733,@edwindjaja_, 2018-03-04, 19:21, Itu tahun 2009. Tapi seiring berjalannya waktu akhirnya perut gw kebiasa juga haha makan jorok sikat. Makan super jorok sikat paling bsk agak mencret dikit tapi yaudah baik baik aja sih,970272949981687809, 2d46dbd9431c332e, Legok, Legok Indonesia,106.60432021752659,-6.292148, iring jala perut gue haha makan jorok sikat makan super jorok sikat mencret dikit aja aja sih
734,@NewRule_NiZha, 2018-03-04, 00:35, 10 menit duduk situ  Kita memilih mending Naik taxi online ajalah dan nnti singgah dlu Di SUCi mau beli Rambutan. Wkwkw sempat2nya yah lagi sakit perut mikirin Rambutan. Akhirnya dapat taxii lalu beli Rambutan  dan pulang ke Kos masing2.,969989575941619712, 83255c3dbe503f8f, Cibeunying Kaler, Cibeunying Kaler Indonesia,107.62925225174729,-6.8864112, menit duduk situ pilih mending taksi online aja nnti singgah sidi suci beli rambutan wkwkw aja sakit perut pikir rambutan taksi beli rambutan pulang tuju kontra
735,@annisayaumila, 2018-03-04, 08:39, dan pagi ini mules-mules efek tahu pedes semalam ........,970111493797593088, aee1f647eb659021, Ngemplak, Ngemplak Indonesia,110.47511750697493,-7.711567,pagi cape efek pedas malam
736,@Santy_afri, 2018-03-04, 21:25, Capcin  bakso  martabak keju  matcha ENDES jd MULES ,970304208812392448, 96915ae1c888404f, Loano, Loano Indonesia,110.06327114034659,-7.6715375,capcin bakso martabak keju matcha darma jd alikuot
737,@NewRule_NiZha, 2018-03-04, 00:37, Maafkan cerita tidak berfaedah ini . Sok sokan si mau makan banyak  tapi perut sdh ga sanggup menampung  yg ada malah sakit perut. ,969990259407597568, 83255c3dbe503f8f, Cibeunying Kaler, Cibeunying Kaler Indonesia,107.62925225174729,-6.8864112,maaf cerita faedah sok sok sang makan perut gue sanggup menampun yg sakit perut
738,@oorangbekasi, 2018-03-04, 21:24, Perut mules bangat  nongkrong kaga ada yg keluar tapinya ,970303988389195777, 8cee089b23296e32, Jatiasih, Jatiasih Indonesia,106.95332798188623,-6.295911,perut mulas bangat tongkrong kagak yg
739,@cahmuktiii, 2018-03-04, 21:17, Penting shof. Kalau misalnya pake plastik  terus gua sakit perut  terus tar gua gabisa masuk kuliah....,970302158804459520, 6066956b38a2b2d9, Pancoran Mas, Pancoran Mas Indonesia,106.81524535347694,-6.3944565,safsaf pakai plastik gua sakit perut tar gua masuk kuliah
740,@bukandiansastr0, 2018-03-04, 18:45, Baru sakit perut karena dapet aja udah nangis  apa lagi melahirkan anak kelak. ,970263840360357888, 0f8cbb99c609cfdf, Tambun, Tambun Indonesia,107.07157315416694,-6.2201165000000005,sakit perut kasih aja uda nang lahir anak kelak
741,@adrnasng, 2018-03-04, 16:49, Sakit perut masa :(,970234668841775105, 408ad88ee0345f7d, Depok, Depok Indonesia,110.40824265575323,-7.76769565,sakit perut
742,@NensyLiu, 2018-03-04, 18:56, Sok sokan dadi dilan rekk... kalo diare kan masih ada diapet ,970266699059482624, c05dfe6f552ce6b1, Gubeng, Gubeng Indonesia,112.75407403620471,-7.2840905,sok sok dadi lang om kalo diare apkir
743,@NensyLiu, 2018-03-04, 20:32, Tenang ae aku wes siap sedia diapet dadi gak usah tuku ,970290935954268160, c05dfe6f552ce6b1, Gubeng, Gubeng Indonesia,112.75407403620471,-7.2840905,tenang ae upam sedia apkir dadi tuku
744,@putryparasayu, 2018-03-04, 19:49, Paling malas ke Tebet naik mobil tuh pas lagi mules-mulesnya. Pergerakan kendaraannya tuh kayak yang niat ga niat jalan :(,970280040054194176, 62f9f7941af63107, Tebet, Tebet Indonesia,106.85685564264601,-6.225841900000002,malas tuju bekas mobil nih pas linu gerak kendara nih kayak niat gue niat jalan
745,@annakadisti, 2018-03-05, 04:57, Sakit perut ini  apakah pertanda masuk angin  sakit mag  atau salah makan? Karena sambel kemarin terlalu pedas  jus stroberinya ga bersih  ataukah kebanyakan makan tahu sumedang dalam sekali hap? :(,970417961088331776, 31569f33fbe4e733, Lowokwaru, Lowokwaru Indonesia,112.60684962877414,-7.943314999999999,sakit perut tanda masuk angin sakit mag salah makan sambal kemarin pedas jus stroberi gue bersih makan bandung hap
746,@adhita_pp, 2018-03-05, 13:23, suriah itu seperti seorang ibu yg sedang 'mules' ingin melahirkan. sakitnya minta ampun. tapi begitu sudah keluar  yang keluar adalah khilafah.,970545400770740224, ae188c2b719d333e, Gondokusuman, Gondokusuman Indonesia,110.38095848372015,-7.786040700000001,suriah orang yg mulas lahir sakit ampun khalifah
747,@ayudyamustika, 2018-03-05, 15:33, Aku kuat aku kuat ...  Mules abis ngopi ...,970577945189269504, 2c0294c5eab821c9, Coblong, Coblong Indonesia,107.6142103008952,-6.88176745,kuat kuat mules abis kopi
748,@rian_Siautta, 2018-03-05, 10:09, Blm sarapan kali makanya bawaannya mules klo abis ngopi,970496466568359936, 849e167064f094d2, Tanjung Priok, Tanjung Priok Indonesia,106.87786932786379,-6.1299044,sarap kali bawa mulas kalo abis kopi
749,@ichafredie, 2018-03-05, 15:03, Miiiih  jangan kasih susu itu lagi. ntar diare. ,970570559091220481, 7349ae0f1fcb7e04, Sleman, Sleman Yogyakarta,110.38061987641008,-7.689311999999999,miiiih kasih susu entar diare
750,@celoteholic, 2018-03-05, 08:35, Pup berikutnya udah balik kaya normal lagi. Sampe ke 2 hari yang lalu. Dilan pup sehari 4x. Tapi gak diare atau gimana juga. Anaknya ceria-ceria aja. Bentuknya normal kaya paste lagi.,970472838967705600, 3d72911db2952869, Ilir Timur II, Ilir Timur II Indonesia,104.82712990849787,-2.9598619999999998,ceguk uda kaya normal ampe tuju  dil bab minggu x diare gim anak ceria aja bentuk normal kaya kopi
751,@febrianti_fr, 2018-03-05, 18:32, Abis makan mules,970623036574466048, 67af0508137cbb0d, Gunung Putri, Gunung Putri Indonesia,106.93888272578371,-6.377322,abis makan mulas
752,@GegFitry, 2018-03-05, 18:18, Sakit perut yg tidak tepat ! ,970619661040590848, df7499d458ab98e0, Abiansemal, Abiansemal Indonesia,115.21266246647356,-8.528892500000001,sakit perut yg
753,@EkoBPPrabowo, 2018-03-05, 16:24, PE kasus terduga toxikasi jamur pada mahasiswa Jepang. Alhamdulillah hasil negatif  diagnosa Gastroenteritis dan diare. @HumasTegalkab @infotegal @dinkestegalkab @mulyonojoko63 @hendadisetia,970590742602072064, 693ffc7a5b01d787, Lebaksiu, Lebaksiu Indonesia,109.12265907517198,-7.027791499999999,pe duga mani jamur mahasiswa jepang alhamdulillah hasil negatif diagnosis gastroenteritis diare humastegalkab tegal dinkestegalkab mulyonojoko hendam
754,@azul_fickar, 2018-03-05, 16:52, Giliran mau masuk kelas malah mules ,970597791700414464, 019ffe0a3471b036, Tanah Abang, Tanah Abang Indonesia,106.81773603395331,-6.2016105,gilir masuk kelas mulas
755,@rikirikian, 2018-03-05, 23:33, Dalam edisi masih sakit perut hadeh,970698923344986112, 25f5e9dbc1b635ac, Gambir, Gambir Indonesia,106.82605578723835,-6.168961,edisi sakit perut adeh
756,@anisaseptiadewi, 2018-03-05, 07:50, Enek enek wae yo menjelang semprop. Sing untune loro lah  sing mencret lah. Alaaahh yuungggg ,970461627932749824, a15ecd30e108f0f5, Kartosuro, Kartosuro Indonesia,110.74905776235859,-7.55958515,tegak enek dewe yo jelang semprot singsing tur lop sing mencret alaaahh yuungggg
757,@ichafredie, 2018-03-05, 14:30, Growsy sih  semua kittenku dulu minum itu. bikinnya jangan keenceran  ntar mencret.,970562225986416641, 7349ae0f1fcb7e04, Sleman, Sleman Yogyakarta,110.38061987641008,-7.689311999999999,growsy sih kucing minum bikin encer entar mencret
758,@ichafredie, 2018-03-05, 17:29, dulu kucing pertamaku juga pernah ku kasih Dancow instan  mencret. sampai dehidrasi. ku opname di klinik  kata dokternya akibat susu Dancow.  di petshop ada susu spesial buat kitten  atau bisa sih susu sgm bebas laktosa.,970607174001967109, 7349ae0f1fcb7e04, Sleman, Sleman Yogyakarta,110.38061987641008,-7.689311999999999,kucing mu kasih susu instan mencret dehidrasi mu opname sidi klinik dokter akibat susu susu sidi toko susu spesial kucing sih susu bebas laktosa
759,@sabbilla, 2018-03-05, 20:56, dok @blogdokter  suami saya cegukan terus sejak hari sabtu  sehari bisa cegukan 6-7 kali dan lama  bisa 1jam-an. awalnya hari sabtu itu dia diare  demam  kmdian mulai cegukan  sekarang alhamdulillah sudah tidak diare  cuma kadang demam. sudah periksa ke dr umum,970659427966640128, c4397d8c10325af5, Kasihan, Kasihan Indonesia,110.33361932383802,-7.8147389999999985,dok dokter suami ceguk sabtu minggu ceguk  kali jaman sabtu diare demam ceguk alhamdulillah diare kadang demam periksa tuju sport
760,@sabbilla, 2018-03-05, 21:00, diberi obat diare dan demam  tapi tidak untuk cegukannya. hmmm  saya googling soal cegukan kok jadi serem sendiri ya dok :( baru kali ini suami saya cegukan berkepanjangan. jadi gimana dok sebaiknya?,970660202507726852, c4397d8c10325af5, Kasihan, Kasihan Indonesia,110.33361932383802,-7.8147389999999985,obat diare demam ceguk hmmm baca ceguk rem ya dok kali suami ceguk gim dok
761,@shikagami07, 2018-03-05, 20:39, Klo suka tinggal bilang Klo kangen tinggal ketemu Klo mules ya tinggal boker gosah ngetwit   Mending klo dibagi bagi ,970655120227577859, f10cf563340b14bb, Pameungpeuk, Pameungpeuk Indonesia,107.58576860452578,-7.021961,kalo suka tinggal bilang kalo kangen tinggal ketemu kalo mulas ya tinggal beol gosah email mending kalo
762,@muhaust, 2018-03-06, 05:52, Mules to the whole new level  sampe liat berita ada cowok punya janin dan kepikiran apa jangan - jangan gua juga gitu,970794100965310465, 399e79a7f42048e2, Sawangan, Sawangan Indonesia,106.76366008726549,-6.3928945000000015,mules mark the whole new level ampe liat berita cowok janin pikir gua aja
763,@MinozAmirah, 2018-03-06, 13:39, Mhihi Iyaaa teh aku nonton return itu bagus. Bner kata tteh mending nonton Waikiki sakit perut nontonnya wkwkkw,970911613334122496, ec43a0e629180bb0, Parungkuda, Parungkuda Indonesia,106.73281606770331,-6.821764999999999,mhihi iyaaa teh tonton retur bagus tteh mending tonton kail sakit perut tonton wkwkkw
764,@PrimandariUtami, 2018-03-06, 10:21," Lg rapat.. Td ngantuk  skrg udah ga ngantuk tp sakit perut.. Mending ga dua""nya ",970861930121318402, d88db2919bf03a65, Denpasar Timur, Denpasar Timur Indonesia,115.23911263358866,-8.633407400000001,lg rapat td antuk uda gue antuk tp sakit perut mending gue
765,@fajrinaAdyt, 2018-03-06, 00:12, Dilan  yang berat itu bukan rindu  tapi perut mules nahan boker. keciprit - keciprit dah lu!,970708560391716865, 55f62fa215b6bc23, Lengkong, Lengkong Indonesia,107.62635912849359,-6.9341678,dil berat rindu perut mulas tahan beol ciprat ciprat dah elu
766,@nabila29__, 2018-03-06, 19:20, Jgn diliat2  bikin takut bikin mules :3,970997627813703681, 66e41950f592f0fc, Maospati, Maospati Indonesia,111.44164742183851,-7.595544999999999,liat bikin takut bikin mulas 
767,@tomsamaja, 2018-03-06, 23:33, F dan F dua nama ini kenapa yah bikin mules... Isi tl merekaaaa doang. Belum yg F satu lagi.. Yg kepo apa agamamu? Pusing dah,971061142767284224, d74066a958870db1, Kebayoran Lama, Kebayoran Lama Indonesia,106.78563265281248,-6.2498520000000015,f f nama aja bikin mulas isi tl doang yg f poin agama pusing dah
768,@haridiva, 2018-03-06, 08:58, Saat ini sedang berlangsung acara RAKERKESNAS tahun 2018 dengan mengangkat tema Sinergisme Pusat & Daerah dalam mewujudkan Universal Health Coverage melalui percepatan Eliminasi Tuberculosis  Penurunan Stunting & Peningkatan Cakupan serta mutu Imunisasi. ,970840948803477509, e5a3682fb71c42d4, Jetis, Jetis Indonesia,110.36337711978932,-7.9095625,acara rakerkesnas  angkat tema sinergis pusat daerah realisasi universal health gepeng cepat eliminasi tuberkulosis turun malnutrisi tingkat cakup mutu imunisasi
769,@herutravis, 2018-03-06, 09:58, Mules gak sudah sudah ,970856038646800384, dd88d16e650304a9, Sukmajaya, Sukmajaya Indonesia,106.84753237199268,-6.3969215,mules
770,@ekawidiiaa, 2018-03-06, 09:16, Tiba2 gw sakit perut  #iHeartAwards #BestFanArmy #BTSARMY @BTS_twt,970845496536215552, f57d760962aa72a0, Denpasar Selatan, Denpasar Selatan Indonesia,115.22570737376896,-8.705968200000001,gue sakit perut video bestfanarmy btsarmy email
771,@rudyantost, 2018-03-06, 20:46, Dok  tolong bikin ulasan tentang Tuberculosis dong.. atau sudah ada?,971019130030600192, d74066a958870db1, Kebayoran Lama, Kebayoran Lama Indonesia,106.78563265281248,-6.2498520000000015,dok tolong bikin ulas tuberkulosis
772,@rositaserlys, 2018-03-07, 06:55, Beberapa hari terakhir alarm bangun pagiku adalah mules pingin boker.,971172412191473664, a15ecd30e108f0f5, Kartosuro, Kartosuro Indonesia,110.74905776235859,-7.55958515,alarm bangun pagi mulas ken beol
773,@july_sm207, 2018-03-07, 02:21, Sorry bro gw gak bisa gabung  sakit perut. Semangat dan Hala Madrid pokoknya.  ,971103535206088704, beddf2d6061ea32e, DKI Jakarta, DKI Jakarta Indonesia,106.84823565767005,-6.23296,maaf bro gue gabung sakit perut semangat putus madrid pokok
774,@salaminzaghi, 2018-03-07, 05:27, Emang udara subuh memang bikin segaarrr dan... Juga bikin mules -_-,971150190592671744, 7706827e5ae21f3f, Serpong, Serpong Indonesia,106.68744135689285,-6.307296,emang udara subuh bikin ekonomi bikin mulas
775,@jh0ez, 2018-03-07, 15:07, Irung buntu  awak nggreges  diare  watuk² dadi siji.... Awak e lagi KO....,971296390272995328, a933df63601f2338, Rungkut, Rungkut Indonesia,112.8040266405806,-7.314341000000001,irung buntu awak dame diare watuk dadi pacik awak e pas
776,@anieanoyy, 2018-03-07, 14:43, iye berhasil sakit perut gara2 mokbang makanin tulang. gublu dasar ,971290249740636161, c23a5ae63324c567, Kelapa Gading, Kelapa Gading Indonesia,106.90964860021738,-6.1591025,iye has sakit perut kanguru makan tulang bacut dasar
777,@GKRHayu, 2018-03-07, 11:55, Diulang biar infonya bener  per request @BerandaJogja jg  Khusus wanita  tapi para lelaki tidak dilarang utk minta resepnya dr pasangan setelahnya.  Mesakake nek wis mules masih bikin sendiri to?   Diiringi ucapan “Nanti Kangmas yg bikin utk Diajeng”  pasti disambut dgn  ,971247924234604544, 41fc11c384c049da, Kraton, Kraton Indonesia,110.36270253873394,-7.8084395,ulang biar info emang request arab jg khusus wanita lelaki resep sport pasang sekak dewe dewe mulas bikin mark iring kangmas yg bikin diajeng sambut
778,@eka4liong, 2018-03-07, 09:08, Kalo RR jd presiden  ibu negara nya mbak artis itu ? *maafkan pertanyaan ga penting ini  sayah lg mules krn kudu nge filing banyak banget*,971205907169202176, 62f9f7941af63107, Tebet, Tebet Indonesia,106.85685564264601,-6.225841900000002,rr jd presiden negara mbak artis maaf gue kemarin lg mulas kudu gue kabinet banget
779,@anomparikesit_, 2018-03-07, 17:57, Cukkkk wqwqwq.... diare njuk main DOTA. Tak tinggal game e :))))) asyuuuuu lhaaa piye menehhhh,971339169162145792, 03c45b795a006ed1, Mergangsan, Mergangsan Indonesia,110.37316029668881,-7.8137310000000015,cukkkk pajak diare keplak main pes tinggal main e asyuuuuu lhaaa dewe menehhhh
780,@DanangNugroho, 2018-03-07, 21:34, Scene brazilian wax di eps. 3 ini sungguh bangke nya luaaarrr biasa... Yawloooh  mpe mules gue    rusuh nih pilem :))),971393705683730434, 3dc0fabe7604a6ac, Pedurungan, Pedurungan Indonesia,110.48033449343784,-7.009436,adegan brazilian lilin sidi eps  sungguh kerangkeng luaaarrr yawloooh sok mulas gue rusuh nih film
781,@annakadisti, 2018-03-07, 19:59, Apaka mules dan diare ini terjadi grgr makan 2 biji pentol pedes pipit td pagi? :(,971369783424729088, 31569f33fbe4e733, Lowokwaru, Lowokwaru Indonesia,112.60684962877414,-7.943314999999999,mulas diare mutisme makan  biji pentol pedas pipit td pagi
782,@B02MERANG, 2018-03-07, 20:07, Ya Allah  sakit perut terus aku : ( Harus makan apasih aku ini : (,971371757205577729, d753c2420f2a8da5, Cilandak, Cilandak Indonesia,106.8022659220577,-6.29272805,ya tuhan sakit perut makan apas
783,@Widhi_Waskito, 2018-03-07, 08:38, Abis rel patah di cilebut .. disambut gangguan CL di manggarai ... perlu kesabaran level dewa .... kecuali pas perut mules nahan BAB ...,971198466671046656, 68b536c5b253c1b0, Kalideres, Kalideres Indonesia,106.71026670119466,-6.1395764999999995,abis rel patah sidi waduk sambut ganggu dam sidi tenggara sabar level dewa kecuali pas perut mulas tahan bab
784,@Asrori__, 2018-03-07, 20:22, Iki cilikane kakean oralit  gedene dadi cerelit,971375476768882688, 080b7578737c363c, Ngluwar, Ngluwar Indonesia,110.28285578001062,-7.6633603,kui cili sake oralit gedempol dadi rit
785,@valencia_amara, 2018-03-07, 20:09," Debat sama org yg cuma punya "" Logika kandang kuda "" bikin mules !",971372166389276672, 6ab2f5132f36eb85, Kuta, Kuta Indonesia,115.17794008938287,-8.725477999999999,debat org yg logika kandang kuda bikin mulas
786,@Adiitoo, 2018-03-07, 07:50, semakin mereka dibikin baper  semakin mudah bagi mereka menganggap uang Rp35 ribu adalah recehan.   nonton #filmdilan1990 udah kek jajan es bon-bon. berkali-kali  bahkan sampai mereka mencret pun tetap mau beli.,971186220230307840, 0c1c821962584454, Pamulang, Pamulang Indonesia,106.72537350841672,-6.3168635,galau mudah anggap uang rp ribu receh tonton filmdilan uda kek jajan es bonbon kali mencret beli
787,@fadhilahrzkn, 2018-03-07, 23:54, Baca grup aja ngakaknya ampe bikin sakit perut ama tenggorokan  punya temen gada yg waras emg,971428798250938368, 4cb9dedf236475ad, Jagakarsa, Jagakarsa Indonesia,106.82795154196195,-6.332802,baca grup aja ketawa ampe bikin sakit perut ama tenggorok teman gada yg waras sok
788,@FendyRome, 2018-03-07, 23:41, Jangan nanti udah bukan terkecing-kencing lagi  bakal mencret-mencret ngotorin lantai ILC aja!,971425713004752896, 1798b59c61cc1381, Batujajar, Batujajar Indonesia,107.44873248892084,-6.897296000000001,uda kencing mencret kotor lantai ilc aja
789,@prdhstaln, 2018-03-08, 00:21, Knpa sukaa sakit perut jam segini whyyyy,971435597318385664, 6e0f0a00ef60a2bf, Kalimantan Barat, Kalimantan Barat Indonesia,111.10989522389193,-0.4793298500000001,knpa suka sakit perut jam gin whyyyy
790,@nnasylvia, 2018-03-08, 06:17, Panik itu   jadwal masuk pagi dan ada temen nanyain tugas dan gue lupa gak garap tugas itu.  Seketika   mules.,971525198368288768, ea9809774c4145c3, Mlati, Mlati Indonesia,110.32923688591045,-7.736615,panik jadwal masuk pagi teman tugas gue lupa garap tugas mulas
791,@arif_luqman, 2018-03-08, 06:19, Duh pagi ini kok sakit perut ya tweeps padahal kemaren gak makan pedes,971525820740071424, 206d5d7a892e40c7, Karang Pilang, Karang Pilang Indonesia,112.68593797035385,-7.335499,duh pagi sakit perut ya cuit kemarin makan pedas
792,@dinarinjani, 2018-03-08, 21:04, Hari ini tuh sbnrnya enak bgt.. mules gak tiba2 dtg.. eh tw2nya pas maghrib...ya ampunnn mulesss pun datang #nikmatinaja #pregnancy #sujudsamaemak,971748468552212480, 555b2219c414bc99, Bekasi Barat, Bekasi Barat Indonesia,106.9806262005378,-6.201172,nih enak banget mulas dtg eh twnya pas nik ampun mulas nikmat pregnancy sujudsamaemak
793,@Gilang231293, 2018-03-09, 11:02, Sakit perut oi gegara makan mie pedes,971959386187771905, 0b07849d325660cd, Sukolilo, Sukolilo Indonesia,112.80783998385029,-7.288131,sakit perut oi gegar makan kopyok pedas
794,@pritaandhinni, 2018-03-09, 12:41, Please lg otw  perut aye knape mules.. ,971984218526957573, a35f6e392c1cf59c, Duduk Sampeyan, Duduk Sampeyan Indonesia,112.52404015478085,-7.1526975,please lg jam perut besok akak mulas
795,@eadeliness, 2018-03-09, 06:56, Mau tidur sejam lagi aja donggg kenapa harus ada acara mules sihhh,971897375332577280, 31569f33fbe4e733, Lowokwaru, Lowokwaru Indonesia,112.60684962877414,-7.943314999999999,tidur jam aja donggg acara mulas sihhh
796,@bellanadyawati, 2018-03-09, 18:49, Sakit perut saat kerja itu menyiksa sekali,972076793959075842, e43562c217bd5097, Banyumanik, Banyumanik Indonesia,110.42004599867649,-7.0681748,sakit perut kerja siksa
797,@romeo_ijen, 2018-03-09, 16:23, Hahahhaja    awas sakit perut co,972040193715855362, afaf25332f11ec56, Kabat, Kabat Indonesia,114.30669392584736,-8.288717,hahahhaja awas sakit perut co
798,@sativasa, 2018-03-09, 18:27, Just got a near death experience: menyetir sambil nahan mules dari limau manis ke jati ditambah macet   gerimis  bajir (+/- 1 jam).,972071334992687104, 5d04f9c6238acf71, Padang Timur, Padang Timur Indonesia,100.38784743830657,-0.94616435,just got a near death experience setir tahan mulas limau manis tuju jati macet gerimis banjir  jam
799,@wahyueko_p_, 2018-03-09, 21:41, Ketika lg nongkrong bareng konco tiba2 mules Tapi pas nyampe rumah mulesnya ilang  Bangke tenan,972120187100004352, e4d3eb9106fe011f, Sukun, Sukun Indonesia,112.61409461977976,-7.989708500000001,lg tongkrong bareng konco mulas pas sampek rumah lemes hilang singkek enak
800,@ArdilahApriani, 2018-03-09, 06:01, Kenapa setiap pms dateng selalu barengan sama sakit perut  badan pada pegel  mood ga beraturan dan ga doyan makan ,971883542601809920, 5b11f2240a885df6, Cikande, Cikande Indonesia,106.34527555147908,-6.161929,pms teng bareng sakit perut badan gel mood gue atur gue doyan makan
801,@nuraziima, 2018-03-09, 04:10, Jangan makan itu  ntar sakit perut ,971855625922658304, 7f745661b459cbbd, Panakkukang, Panakkukang Indonesia,119.47285621011446,-5.15920965,makan entar sakit perut
802,@rikirikian, 2018-03-10, 04:01, Adoh aku sebel aku sakit perut ngabisa tidooooorrrrrrr hhhhhhhhhhhhhhhhhhhhhhhhhhhhhhh,972215777066545153, 66555622726ab358, Setia Budi, Setia Budi Indonesia,106.8350755724146,-6.2213485,sebel sakit perut abis tidooooorrrrrrr hhhhhhhhhhhhhhhhhhhhhhhhhhhhhhh
803,@imanIMNDN, 2018-03-10, 07:44, Sakit perut akibat makan seblak pedas dan ceker setan selama 2 hari berturut-turut. yamogimanalagi habis enak sih,972271990122823685, 67ee4e65b49cb758, Kalimantan Selatan, Kalimantan Selatan Indonesia,115.51599417801836,-2.74566825,sakit perut akibat makan geblak pedas ceker setan  yamogimanalagi habis enak sih
804,@akbarpbryan, 2018-03-10, 10:02, Kangennya kaya diare ya  bentar bentar kambuh gak sembuh sembuh,972306563112169473, 2c0294c5eab821c9, Coblong, Coblong Indonesia,107.6142103008952,-6.88176745,kangen kaya diare ya bentar bentar kambuh sembuh sembuh
805,@agroinovasi, 2018-03-10, 11:06, Secara empirik  #Pegagan bermanfaat sebagai penyembuh luka  radang  teumatik  asma  wasir  tuberkulosis  lepra  disentri  demam dan penambah selera makan.,972322672481779712, dd111d5dd4287fd8, Bojonggede, Bojonggede Indonesia,106.78065878380468,-6.4608865,empiris gaga sembuh luka radang rematik asma wasir tuberkulosis lepra disentri demam selera makan
806,@ryanjulian_, 2018-03-10, 10:27, mules. @ Pelabuhan penyeberangan Bakahuni https://www.instagram.com/p/BgIKjszhtuG/ ,972312869969776640, a68735f9fabe899d, Penengahan, Penengahan Indonesia,105.73727019523315,-4.9274369999999985,mulas labuh seberang baka
807,@nevykiani, 2018-03-10, 11:14, Aduh mules-mules apa nih ,972324903645937664, e4d3eb9106fe011f, Sukun, Sukun Indonesia,112.61409461977976,-7.989708500000001,aduh cape nih
808,@Innosensius_, 2018-03-10, 09:19, Enak kok kalo kepepet. Paling juga pilek sama diare. Wkwkwkw,972295859143565312, f689b1ed479bbfa4, Ngaglik, Ngaglik Indonesia,110.40428210119288,-7.712573,enak kalo pepet pilek diare wkwkwkw
809,@lilismisna, 2018-03-10, 05:04, Omg salah makan apa dah gw diare jam segini,972231778399219712, 25f5e9dbc1b635ac, Gambir, Gambir Indonesia,106.82605578723835,-6.168961,ehe salah makan dah gue diare jam gin
810,@siriuslyelmo, 2018-03-10, 16:04, Njir baru 15 menit udah sakit perut ngakak2  #PunkInLove,972397760757481472, 2e1008fd77a5b1bf, Pondokgede, Pondokgede Indonesia,106.92829516093106,-6.2931675,njir  menit uda sakit perut ketawa cetak
811,@BIGREDS_PTK, 2018-03-10, 19:24, Itu lagi pada nahan mules ya?,972447996276195329, 6e0f0a00ef60a2bf, Kalimantan Barat, Kalimantan Barat Indonesia,111.10989522389193,-0.4793298500000001,tahan mulas ya
